{
  "$schema": "https://json-schema.org/draft/2020-12/schema",
  "$id": "https://ruddvz.github.io/Aether/schemas/aether-photometry-candidate.schema.json",
  "title": "AETHERIA Photometry Candidate",
  "type": "object",
  "additionalProperties": false,
  "required": [
    "schemaVersion",
    "fixtureId",
    "candidateId",
    "status",
    "manufacturer",
    "family",
    "configurations",
    "sources",
    "review"
  ],
  "properties": {
    "schemaVersion": {
      "const": "1.0.0"
    },
    "fixtureId": {
      "type": "string",
      "minLength": 1
    },
    "candidateId": {
      "type": "string",
      "pattern": "^[a-z0-9][a-z0-9._-]*$"
    },
    "status": {
      "enum": [
        "research-only",
        "shortlisted",
        "sample-requested",
        "photometry-received",
        "prototype-tested",
        "approved",
        "rejected"
      ]
    },
    "manufacturer": {
      "type": "string",
      "minLength": 1
    },
    "family": {
      "type": "string",
      "minLength": 1
    },
    "regionAvailability": {
      "type": "array",
      "items": {
        "type": "string"
      },
      "uniqueItems": true
    },
    "finishOptions": {
      "type": "array",
      "items": {
        "type": "string"
      },
      "uniqueItems": true
    },
    "configurations": {
      "type": "array",
      "minItems": 1,
      "items": {
        "type": "object",
        "additionalProperties": false,
        "required": [
          "role",
          "exactModelCode",
          "opticCode",
          "cctK",
          "cri",
          "photometryStatus"
        ],
        "properties": {
          "role": {
            "enum": [
              "deep-tail narrow",
              "mid-field spot",
              "upper-field flood",
              "central accent",
              "other"
            ]
          },
          "exactModelCode": {
            "type": [
              "string",
              "null"
            ],
            "minLength": 1
          },
          "opticCode": {
            "type": [
              "string",
              "null"
            ],
            "minLength": 1
          },
          "cctK": {
            "type": [
              "number",
              "null"
            ],
            "minimum": 1800,
            "maximum": 10000
          },
          "cri": {
            "type": [
              "number",
              "null"
            ],
            "minimum": 0,
            "maximum": 100
          },
          "beamAngleDegPublished": {
            "type": [
              "number",
              "null"
            ],
            "exclusiveMinimum": 0,
            "maximum": 180
          },
          "powerW": {
            "type": [
              "number",
              "null"
            ],
            "minimum": 0
          },
          "lumens": {
            "type": [
              "number",
              "null"
            ],
            "minimum": 0
          },
          "dimensionsMm": {
            "type": [
              "array",
              "null"
            ],
            "minItems": 3,
            "maxItems": 3,
            "items": {
              "type": "number",
              "exclusiveMinimum": 0
            }
          },
          "driverModel": {
            "type": [
              "string",
              "null"
            ]
          },
          "dimming": {
            "type": "array",
            "items": {
              "type": "string"
            },
            "uniqueItems": true
          },
          "photometryStatus": {
            "enum": [
              "missing",
              "linked",
              "downloaded",
              "parsed",
              "verified"
            ]
          },
          "iesPath": {
            "type": [
              "string",
              "null"
            ]
          },
          "iesSha256": {
            "type": [
              "string",
              "null"
            ],
            "pattern": "^[0-9a-f]{64}$"
          },
          "notes": {
            "type": [
              "string",
              "null"
            ]
          }
        }
      }
    },
    "sources": {
      "type": "object",
      "additionalProperties": false,
      "required": [
        "productPage",
        "datasheet"
      ],
      "properties": {
        "productPage": {
          "type": "string",
          "format": "uri"
        },
        "datasheet": {
          "type": [
            "string",
            "null"
          ],
          "format": "uri"
        },
        "photometryDownload": {
          "type": [
            "string",
            "null"
          ],
          "format": "uri"
        },
        "manufacturerContact": {
          "type": [
            "string",
            "null"
          ]
        }
      }
    },
    "review": {
      "type": "object",
      "additionalProperties": false,
      "required": [
        "exactConfigurationConfirmed",
        "officialPhotometryAvailable",
        "notes"
      ],
      "properties": {
        "exactConfigurationConfirmed": {
          "type": "boolean"
        },
        "officialPhotometryAvailable": {
          "type": "boolean"
        },
        "meetsPhysicalTarget": {
          "type": [
            "boolean",
            "null"
          ]
        },
        "meetsOpticalTarget": {
          "type": [
            "boolean",
            "null"
          ]
        },
        "meetsControlTarget": {
          "type": [
            "boolean",
            "null"
          ]
        },
        "notes": {
          "type": "string"
        }
      }
    },
    "$schema": {
      "type": "string"
    }
  }
}
